<?xml version="1.0" encoding="utf-8"?>
<tickets xmlns:xsi="http://www.w3.org/2001/XMLSchema-instance" xsi:noNamespaceSchemaLocation="supportticket.xsd">
<ticket number="1522378312" status="resolved" supportCat="Something isn't Working" client="1"><date>2018-03-30</date><title>I love your website </title><message userId="1" datetime="2018-03-30 04:51:52">You have the best interface for this assignment! Good work, keep giving you best effort</message><response userId="2" datetime="2018-03-30 04:54:35">Thank you! </response></ticket><ticket number="1522378398" status="resolved" supportCat="Something isn't Working" client="3"><date>2018-03-30</date><title>My follow button isn't working </title><message userId="3" datetime="2018-03-30 04:53:18">Please can someone check that out, i can't seem to be able to follow anyone. &#13;
Thanks</message><response userId="2" datetime="2018-03-30 04:54:59">It's working now </response></ticket><ticket number="1522378743" status="resolved" supportCat="General Feedback" client="1"><date>2018-03-30</date><title>Hey </title><message userId="1" datetime="2018-03-30 04:59:03">Thanks for always being there </message><response userId="2" datetime="2018-03-30 05:08:45">you're welcome </response></ticket><ticket number="1522687242" status="resolved" supportCat="Spam or Abuse" client="3"><date>2018-04-02</date><title>Hey there </title><message userId="3" datetime="2018-04-02 18:40:42">window.onload = pageReady()</message><response userId="2" datetime="2018-04-02 18:41:40">vggvgvv</response><response userId="2" datetime="2018-04-02 18:41:40">vggvgvv</response></ticket></tickets>
